{
  "control_count": 19,
  "control_ids": [
    "CTRL-CLUSTER-0001",
    "CTRL-CLUSTER-0002",
    "CTRL-CLUSTER-0003",
    "CTRL-CLUSTER-0004",
    "CTRL-GITOPS-0001",
    "CTRL-GITOPS-0002",
    "CTRL-GITOPS-0003",
    "CTRL-GITOPS-0004",
    "CTRL-GITOPS-0005",
    "CTRL-NET-0001",
    "CTRL-NET-0002",
    "CTRL-NET-0003",
    "CTRL-NET-0004",
    "CTRL-RBAC-0001",
    "CTRL-RBAC-0002",
    "CTRL-SECRETS-0001",
    "CTRL-SECRETS-0002",
    "CTRL-WORKLOAD-0001",
    "CTRL-WORKLOAD-0002"
  ],
  "controls": [
    {
      "description": "This control groups the first deterministic cluster-hardening checks around Pod Security posture: missing namespace enforcement labels, unsafe hostPath usage, and edge cases that undermine expected pod security restrictions.\n",
      "detection_modes": [
        "native_rule"
      ],
      "evidence_expectations": {
        "corroborating_sources": [
          "kubectl get namespace -o yaml",
          "kubectl get deployment,pv -o yaml",
          "admission event output"
        ],
        "intent_signals": [
          "namespace pod-security labels",
          "volume.hostPath",
          "security admission configuration"
        ],
        "live_signals": [
          "workloads running with host filesystem access",
          "admission behavior diverging from expected pod-security posture"
        ]
      },
      "example_refs": [],
      "family": "cluster-hardening",
      "id": "CTRL-CLUSTER-0001",
      "maturity": "seeded",
      "name": "Pod security and hostPath baseline",
      "pattern_refs": [
        {
          "category": "CONFIG",
          "confidence": "high",
          "id": "CCVE-2025-0724",
          "name": "hostPath PV bypasses Pod Security Policy restrictions",
          "severity": {
            "bucket": "critical",
            "raw": "critical"
          },
          "tags": [],
          "track": "misconfiguration"
        },
        {
          "category": "CONFIG",
          "confidence": "high",
          "id": "CCVE-2025-0921",
          "name": "Pod Security Admission rejects lowercase capability \"all\"",
          "severity": {
            "bucket": "warning",
            "raw": "warning"
          },
          "tags": [],
          "track": "misconfiguration"
        },
        {
          "category": "SECURITY",
          "confidence": "high",
          "id": "CCVE-2025-3737",
          "name": "Deployment mounts hostPath volume",
          "severity": {
            "bucket": "critical",
            "raw": "critical"
          },
          "tags": [
            "deployment",
            "security",
            "volumes",
            "hostpath",
            "static-scan",
            "pre-deploy"
          ],
          "track": "misconfiguration"
        },
        {
          "category": "SECURITY",
          "confidence": "high",
          "id": "CCVE-2025-3763",
          "name": "Namespace lacks Pod Security Standards enforcement labels",
          "severity": {
            "bucket": "warning",
            "raw": "warning"
          },
          "tags": [
            "namespace",
            "security",
            "pod-security-standards",
            "static-scan",
            "pre-deploy"
          ],
          "track": "misconfiguration"
        }
      ],
      "remediation": {
        "guidance": [
          "Enforce Pod Security Standards labels at the namespace boundary by default.",
          "Treat hostPath mounts as reviewed exceptions rather than normal workload configuration.",
          "Validate pod security policy and admission behavior with real manifests, not only policy intent."
        ],
        "safety_class": "review_required",
        "strategy": "config_fix"
      },
      "resource_kinds": [
        "Namespace",
        "Deployment",
        "PersistentVolume"
      ],
      "severity": "critical",
      "slug": "pod-security-and-hostpath-baseline",
      "source_path": "/Users/alexis/Public/github-repos/confighub-patterns/controls/cluster/pod-security-and-hostpath-baseline.yaml",
      "summary": "Detect namespace and workload defaults that weaken pod security boundaries or reintroduce host filesystem access.",
      "supported_consumers": [
        "cli",
        "cub_scout",
        "confighub",
        "sdk",
        "ai"
      ],
      "supported_surfaces": [
        "static",
        "live_state"
      ],
      "tags": [
        "cluster",
        "pod-security",
        "hostpath",
        "namespace",
        "baseline"
      ]
    },
    {
      "description": "This control groups the certificate lifecycle and TLS configuration failures that operators need surfaced before they become node outages or cluster-wide trust failures: kubelet rotation problems, weak kubelet TLS posture, expired API server certificates, and broken reloading of rotated client certs.\n",
      "detection_modes": [
        "native_rule"
      ],
      "evidence_expectations": {
        "corroborating_sources": [
          "kubelet logs",
          "API server logs",
          "certificate expiry inspection"
        ],
        "intent_signals": [
          "kubelet TLS configuration",
          "certificate rotation settings",
          "control-plane certificate lifecycle config"
        ],
        "live_signals": [
          "expired or stale certs",
          "node or control-plane disruption after rotation"
        ]
      },
      "example_refs": [],
      "family": "cluster-hardening",
      "id": "CTRL-CLUSTER-0002",
      "maturity": "seeded",
      "name": "Control plane certificate baseline",
      "pattern_refs": [
        {
          "category": "STATE",
          "confidence": "high",
          "id": "CCVE-2025-0207",
          "name": "Kubernetes API server loopback certificate expires after 1 year",
          "severity": {
            "bucket": "critical",
            "raw": "critical"
          },
          "tags": [],
          "track": "misconfiguration"
        },
        {
          "category": "CONFIG",
          "confidence": "high",
          "id": "CCVE-2025-0228",
          "name": "Kubernetes kubelet certificate rotation failures cause service disruption",
          "severity": {
            "bucket": "critical",
            "raw": "critical"
          },
          "tags": [],
          "track": "misconfiguration"
        },
        {
          "category": "STATE",
          "confidence": "high",
          "id": "CCVE-2025-0275",
          "name": "kubelet certificate rotation fails silently",
          "severity": {
            "bucket": "critical",
            "raw": "critical"
          },
          "tags": [],
          "track": "misconfiguration"
        },
        {
          "category": "CONFIG",
          "confidence": "high",
          "id": "CCVE-2025-1133",
          "name": "Kubelet accepts weak TLS ciphersuites by default",
          "severity": {
            "bucket": "warning",
            "raw": "warning"
          },
          "tags": [],
          "track": "misconfiguration"
        },
        {
          "category": "CONFIG",
          "confidence": "high",
          "id": "CCVE-2025-1164",
          "name": "Kubelet uses wrong certificate on startup after rotation",
          "severity": {
            "bucket": "warning",
            "raw": "warning"
          },
          "tags": [],
          "track": "misconfiguration"
        },
        {
          "category": "STATE",
          "confidence": "high",
          "id": "CCVE-2025-1165",
          "name": "API server does not reload rotated kubelet client certificate",
          "severity": {
            "bucket": "warning",
            "raw": "warning"
          },
          "tags": [],
          "track": "misconfiguration"
        },
        {
          "category": "CONFIG",
          "confidence": "high",
          "id": "CCVE-2025-2472",
          "name": "kubelet TLS bootstrap certificate not valid for node hostname",
          "severity": {
            "bucket": "critical",
            "raw": "high"
          },
          "tags": [],
          "track": "misconfiguration"
        },
        {
          "category": "CONFIG",
          "confidence": "high",
          "id": "CCVE-2025-2478",
          "name": "apiserver-etcd-client certificate expired breaks cluster",
          "severity": {
            "bucket": "critical",
            "raw": "critical"
          },
          "tags": [],
          "track": "misconfiguration"
        }
      ],
      "remediation": {
        "guidance": [
          "Monitor certificate rotation and expiry as part of cluster health, not only during upgrades.",
          "Prefer explicit, modern TLS posture for kubelet and control-plane components.",
          "Validate both issuance and reload behavior when rotating kubelet or API server certificates."
        ],
        "safety_class": "review_required",
        "strategy": "diagnose_then_fix"
      },
      "resource_kinds": [
        "Node",
        "KubeletConfiguration",
        "APIServer"
      ],
      "severity": "critical",
      "slug": "control-plane-certificate-baseline",
      "source_path": "/Users/alexis/Public/github-repos/confighub-patterns/controls/cluster/control-plane-certificate-baseline.yaml",
      "summary": "Detect certificate rotation and TLS posture failures that quietly degrade kubelet and control-plane trust.",
      "supported_consumers": [
        "cli",
        "cub_scout",
        "confighub",
        "sdk",
        "ai"
      ],
      "supported_surfaces": [
        "static",
        "live_state"
      ],
      "tags": [
        "cluster",
        "kubelet",
        "apiserver",
        "tls",
        "certificates",
        "baseline"
      ]
    },
    {